{
  "schemaVersion": "0.1",
  "profile": "axiom-css",
  "profileInputDigest": "sha256:b26a0501c6ee972ca343d2f91be620aaef0c719ec5602a2a70f317fd22135d75",
  "recipeId": "button",
  "entries": [{
    "id": "collision-0001", "relation": "condition-overlap", "conditionRelation": "superset", "affectedProperty": "color",
    "earlier": { "property": "color", "origin": { "recipeId": "button", "slot": "root", "stage": "condition", "source": "button.ts#/conditions/0/apply/root/color" }, "policyProvenance": [{ "rule": "standard", "source": "status-default" }, { "rule": "paint", "source": "policy-group" }, { "rule": "color-paint", "source": "token-binding-catalog" }], "applicability": { "variants": [], "states": [], "condition": { "all": ["viewport.width.sm"] } } },
    "later": { "property": "color", "origin": { "recipeId": "button", "slot": "root", "stage": "condition", "source": "button.ts#/conditions/1/apply/root/color" }, "policyProvenance": [{ "rule": "standard", "source": "status-default" }, { "rule": "paint", "source": "policy-group" }, { "rule": "color-paint", "source": "token-binding-catalog" }], "applicability": { "variants": [], "states": [], "condition": { "all": ["viewport.width.md"] } } },
    "winner": "later"
  }]
}
